{
  "title": "협업 문의 - pw9923@gmail.com",
  "eyebrow": "",
  "emptyMessage": "새로운 소식을 준비하고 있어요. 곧 만나요!",
  "items": [
    {
      "id": "main-instagram",
      "title": "Instagram",
      "variant": "featured",
      "image": "media/onari-instagram.jpg",
      "imageAlt": "오나리 Instagram에 사용하는 캐릭터 이미지",
      "enabled": true,
      "openInNewTab": true,
      "destination": "instagram",
      "imageFit": "cover",
      "imagePosition": "center"
    },
    {
      "id": "main-tiktok",
      "title": "TikTok",
      "variant": "compact",
      "enabled": true,
      "openInNewTab": true,
      "destination": "tiktok",
      "image": "media/onari-tiktok.jpg"
    },
    {
      "id": "main-youtube",
      "title": "YouTube",
      "variant": "compact",
      "enabled": true,
      "openInNewTab": true,
      "destination": "youtube",
      "image": "media/onari-youtube.jpg"
    }
  ]
}
